{"candidateDecision":{"candidateHash":"sha256:eb2365a1fb7190138a46705a09f9b94d00836f46df0d16021b9336ede21015bb","candidateOrdinal":0,"contextHash":"sha256:f7c9aa4a018243b001475be324bc7d25b1598340e702644febbc7f967591521c","councilEpochId":"shadow-council-decision-record-persistence-v1-smoke-epoch","decisionRequestId":"shadow-council-decision-record-persistence-v1-smoke-1","proposalContent":{"payload":{"conditions":["Do not treat this record as a real architecture or authorization decision."],"effect":"no-op","purpose":"SHADOW-COUNCIL-DECISION-RECORD-PERSISTENCE-V1 validation","recommendation":"approve","scope":"documentation-only"},"summary":"Approve the harmless synthetic R2 smoke candidate solely to verify DecisionRecord persistence end-to-end against real seat CLIs."},"proposerSeatId":"seat-openai","repositoryHead":"f05d01f766e74abdeaac8e8fe9b6835eb366a83e","riskClass":"R2","taskId":"SHADOW-COUNCIL-DECISION-RECORD-PERSISTENCE-V1"},"candidateHash":"sha256:eb2365a1fb7190138a46705a09f9b94d00836f46df0d16021b9336ede21015bb","contextHash":"sha256:f7c9aa4a018243b001475be324bc7d25b1598340e702644febbc7f967591521c","councilEpochId":"shadow-council-decision-record-persistence-v1-smoke-epoch","decisionQuestion":"Harmless synthetic R2 smoke candidate: should this bounded, no-op documentation-only decision be approved for the sole purpose of proving DecisionRecord persistence works end-to-end against real seat CLIs?","decisionRequestId":"shadow-council-decision-record-persistence-v1-smoke-1","evidence":["This is a synthetic smoke exercise for SHADOW-COUNCIL-DECISION-RECORD-PERSISTENCE-V1; it is not a real architecture or authorization decision."],"outputContract":{"artifact":"ShadowVoteAssessment","jsonOnly":true,"requiredFields":["voteValue","rationale"]},"packetHash":"sha256:61d687030f40ae8a7f1989da3312b00942c8134d59a85ffa3eeb1f1c7e0541fb","repositoryHead":"f05d01f766e74abdeaac8e8fe9b6835eb366a83e","riskClass":"R2","seatId":"seat-google","seatRole":"REVIEWER","taskId":"SHADOW-COUNCIL-DECISION-RECORD-PERSISTENCE-V1"}