{"candidateDecision":{"candidateHash":"sha256:2aaca3d99983d0b74858e4ab984eb45e597461140018a3fd6a38f4fa840de802","candidateOrdinal":0,"contextHash":"sha256:2321912769f8c7f617c15aa2fdd3a7196b7ee9966064c4a794588ebef8c93236","councilEpochId":"epoch-reviewer-reliability-smoke-1","decisionRequestId":"shadow-council-reviewer-reliability-smoke-1","proposalContent":{"payload":{"analysis":{"a_headroom":"A ~600 generation budget leaves ~600 characters (2x) of slack against the 1200 hard ceiling, which comfortably absorbs normal verbosity variance and makes first-call compliance the expected case rather than a coin flip.","b_truncation_confusion":"Real but low and mitigable. The confusion mode comes from presenting two numbers as competing ceilings; presenting one as the aim and one as the do-not-exceed self-check, with an explicit 'finish the sentence, prefer shorter, never truncate mid-sentence' clause, resolves the ambiguity. The budget is prompt-level guidance only and is never enforced by the parser, so overshoot below 1200 remains a pass, not a failure.","c_root_cause":"Consistent with the V3/V4 evidence but not proven by it. Stating a single number equal to the acceptance ceiling makes that number function as an anchor/target rather than a limit, and leaves zero slack for verbosity variance, so any overshoot is an immediate hard failure. Two independent seat-anthropic failures on non-retried first calls fit that pattern. Recommend logging observed rationale lengths in the next exercise to confirm the anchoring hypothesis rather than treating it as settled.","d_provider_neutrality":"Preserved. The guidance is plain natural-language prose with no vendor-specific parameters, tokenizer assumptions, or schema features, so seat-anthropic, seat-openai, and seat-google receive a byte-identical instruction. Character counts (not tokens) keep the instruction tokenizer-agnostic. Per-seat tuning of the numbers would break provider neutrality and should be avoided.","e_cli_constraints":"Prompt-level generation budget alone is the right first step; do not add CLI-level structured-output or max-token constraints in this change. A hard token cap converts a soft overshoot into a mid-sentence truncation and likely invalid JSON, which is a worse failure than the current one on constrained token budgets. If the budget instruction proves insufficient, the correct escalation is a single validation-triggered reprompt ('your rationale was N characters; rewrite it under 500') rather than decoder-level clamps, because a reprompt preserves well-formed output."},"confidence":"medium-high","followups":["Instrument the next exercise to record per-seat rationale character counts so the anchoring hypothesis in (c) is confirmed or falsified with data.","Add one bounded retry on CHARACTER_LIMIT before failing ASSESSMENT_VALIDATION, so a single overshoot does not sink the exercise."],"recommendation":{"budget_is_soft_prompt_level_only":true,"ceiling_unchanged":true,"generation_budget_chars":600,"hard_acceptance_ceiling_chars":1200,"target_chars":500},"residual_risks":["Model may still anchor on the 600 figure and consistently produce ~600-character rationales; acceptable, since that is half the hard ceiling.","Two numbers add prompt surface that must be kept consistent if the ceiling is ever revised; mitigate by deriving the documented numbers from the ceiling constant in the packet template rather than hardcoding them in prose in multiple places."],"scope_guardrails":["Hard acceptance ceiling of 1200 characters / 4096 UTF-8 bytes stays enforced in the parser/builder and is untouched.","Change is confined to the reviewer prompt packet text; no change to ADR-0005 quorum semantics, DecisionRecord.recordHash, or any authorization/execution boundary.","Advisory evidence only; zero effect on quorum."],"suggested_prompt_language":"Write the rationale as prose of about 500 characters. Do not exceed 600 characters. If you are nearing that budget, finish the current sentence and stop rather than continuing; a shorter complete rationale is always preferred over a longer one. Never emit a truncated or mid-sentence rationale.","vote":"two_number_scheme"},"summary":"Recommend the two-number scheme: state a target (~500 characters) plus a strictly lower generation budget (~600) as a self-check ceiling, keeping the 1200-character hard acceptance ceiling unchanged and unmentioned as a target; fix via prompt guidance plus a single validation-triggered reprompt, not CLI token clamps."},"proposerSeatId":"seat-anthropic","repositoryHead":"40f2dc3933547a2620ce706330f9086274059c8c","riskClass":"R1","taskId":"shadow-council-reviewer-output-reliability-v1-smoke"},"candidateHash":"sha256:2aaca3d99983d0b74858e4ab984eb45e597461140018a3fd6a38f4fa840de802","contextHash":"sha256:2321912769f8c7f617c15aa2fdd3a7196b7ee9966064c4a794588ebef8c93236","councilEpochId":"epoch-reviewer-reliability-smoke-1","decisionQuestion":"For MIHVER's Shadow Council reviewer packet only (advisory evidence, zero effect on quorum): should the reviewer prompt's rationale generation guidance state both a target character count and a strictly lower hard-ceiling-safe generation budget (e.g. target ~500, generation budget ~600, hard acceptance ceiling 1200 unchanged), or should it state only a single number equal to the acceptance ceiling? Consider: (a) headroom against normal model verbosity variance so first-call compliance is more likely; (b) risk that a two-number scheme confuses a reviewer model into truncating mid-sentence; (c) whether a single number close to the ceiling caused the V3/V4 seat-anthropic CHARACTER_LIMIT failures; (d) provider-neutrality across seat-anthropic, seat-openai, seat-google receiving the identical instruction; (e) whether this is better fixed with a generation-budget instruction alone or would need CLI-level structured-output constraints too, and the trade-off of adding those given truncation risk on constrained token budgets.","decisionRequestId":"shadow-council-reviewer-reliability-smoke-1","evidence":["V3 and V4 real Shadow Council exercises both failed ASSESSMENT_VALIDATION because seat-anthropic's rationale exceeded the 1200-character hard acceptance ceiling on the first (and only, non-retried) call.","The hard acceptance ceiling (1200 characters / 4096 UTF-8 bytes) is enforced independently in the parser/builder and is out of scope for this decision -- it must not change.","This vote is advisory evidence only: it has zero effect on ADR-0005 quorum semantics, DecisionRecord.recordHash, or any authorization/execution boundary."],"outputContract":{"artifact":"ShadowVoteAssessment","jsonOnly":true,"requiredFields":["voteValue","rationale"]},"packetHash":"sha256:0b7ef264b65a903d5254ae45e874fcc0aa138e709104a92686c1e379b4ebe82f","repositoryHead":"40f2dc3933547a2620ce706330f9086274059c8c","riskClass":"R1","seatId":"seat-google","seatRole":"REVIEWER","taskId":"shadow-council-reviewer-output-reliability-v1-smoke"}