{"contextHash":"sha256:e12fd7df3125b5464e02c9005ab14e453c954d49b093c6c22d8eabdad024c380","councilEpochId":"authorization-ledger-v1c-r3-architecture-v3-epoch-1","decisionQuestion":"What exact V1C privileged architecture should MIHVER adopt for the Authorization Ledger, human R3 AuthorizationGrant administration, trusted Council/evidence import boundary, and global stopEpoch register, while preserving strict privilege separation and guaranteeing that V1C has zero execution-effect consumers?","decisionRequestId":"authorization-ledger-v1c-r3-arch-decision-3","evidence":[],"outputContract":{"artifact":"AgentProposal","jsonOnly":true,"requiredFields":["summary","payload"]},"packetHash":"sha256:e6a5cc6deb8009ca02e0026425cc921d95a62b9b6eecdd6d01158891acfaa472","repositoryHead":"27da4a0708ad7d0a67c7c96ff65849b467372bd6","riskClass":"R3","seatId":"seat-google","seatRole":"PROPOSER","taskId":"AUTHORIZATION-LEDGER-V1C-R3-ARCHITECTURE-DECISION-V3"}