{"contextHash":"sha256:3ea1409ace2038188ad0a2417fbcf6ec4106bb60b69ea30a9afb4cbf97ef0594","councilEpochId":"contemporaneous-quorum-evidence-v1-smoke-epoch","decisionQuestion":"Should a project's developer documentation state the required Node.js major version explicitly, rather than leaving contributors to infer it from CI configuration?","decisionRequestId":"contemporaneous-quorum-evidence-v1-smoke-r2","evidence":["Contributors currently discover the expected Node.js version only by reading the CI workflow.","An explicitly documented version reduces onboarding friction and environment drift.","This question is a harmless documentation-practice question and is unrelated to any MIHVER architecture decision."],"outputContract":{"artifact":"AgentProposal","jsonOnly":true,"requiredFields":["summary","payload"]},"packetHash":"sha256:ac043a34bc1fec2276d3f635082377fd44934472f98bba05a2d0aefda8dbcf9c","repositoryHead":"3b1ec8f30b2e85b3f07e8cfb2b1274038e02c96b","riskClass":"R2","seatId":"seat-openai","seatRole":"PROPOSER","taskId":"SHADOW-COUNCIL-CONTEMPORANEOUS-QUORUM-EVIDENCE-V1"}