{"candidateDecision":{"candidateHash":"sha256:69224bbf74832529b8275c7cd1a51e045147a4793c594ed2e49195c0141a0507","candidateOrdinal":0,"contextHash":"sha256:3ea1409ace2038188ad0a2417fbcf6ec4106bb60b69ea30a9afb4cbf97ef0594","councilEpochId":"contemporaneous-quorum-evidence-v1-smoke-epoch","decisionRequestId":"contemporaneous-quorum-evidence-v1-smoke-r2","proposalContent":{"payload":{"rationale":["Reduces onboarding friction","Prevents local environment drift","Makes the requirement easier to discover"],"recommendation":"Document the required Node.js major version in the contributor or setup documentation instead of relying on contributors to infer it from CI configuration.","scope":"Documentation practice only; unrelated to MIHVER architecture decisions."},"summary":"Yes, the developer documentation should explicitly state the required Node.js major version."},"proposerSeatId":"seat-openai","repositoryHead":"3b1ec8f30b2e85b3f07e8cfb2b1274038e02c96b","riskClass":"R2","taskId":"SHADOW-COUNCIL-CONTEMPORANEOUS-QUORUM-EVIDENCE-V1"},"candidateHash":"sha256:69224bbf74832529b8275c7cd1a51e045147a4793c594ed2e49195c0141a0507","contextHash":"sha256:3ea1409ace2038188ad0a2417fbcf6ec4106bb60b69ea30a9afb4cbf97ef0594","councilEpochId":"contemporaneous-quorum-evidence-v1-smoke-epoch","decisionQuestion":"Should a project's developer documentation state the required Node.js major version explicitly, rather than leaving contributors to infer it from CI configuration?","decisionRequestId":"contemporaneous-quorum-evidence-v1-smoke-r2","evidence":["Contributors currently discover the expected Node.js version only by reading the CI workflow.","An explicitly documented version reduces onboarding friction and environment drift.","This question is a harmless documentation-practice question and is unrelated to any MIHVER architecture decision."],"outputContract":{"artifact":"ShadowVoteAssessment","jsonOnly":true,"requiredFields":["voteValue","rationale"]},"packetHash":"sha256:2205c2013552075f263e3a15da242c454032969fec14c8b750e82e47654c2c0d","repositoryHead":"3b1ec8f30b2e85b3f07e8cfb2b1274038e02c96b","riskClass":"R2","seatId":"seat-anthropic","seatRole":"REVIEWER","taskId":"SHADOW-COUNCIL-CONTEMPORANEOUS-QUORUM-EVIDENCE-V1"}