{"candidateDecision":{"candidateHash":"sha256:540531293d50ea6e6f6128203481ea309e077491950578eb3bf543cff5b6e9f3","candidateOrdinal":0,"contextHash":"sha256:e12fd7df3125b5464e02c9005ab14e453c954d49b093c6c22d8eabdad024c380","councilEpochId":"authorization-ledger-v1c-r3-architecture-v3-epoch-1","decisionRequestId":"authorization-ledger-v1c-r3-arch-decision-3","proposalContent":{"payload":{"architecture_tier":"V1C (Privileged Verification and Authorization Enclave)","authorization_ledger":{"data_structure":"Append-only authenticated Merkle accumulator / Sparse Merkle Tree (SMT)","properties":["Cryptographically signed state transitions with non-repudiation","Deterministic replayability and zero-knowledge / inclusion-exclusion proof generation","Strict read-only egress access for external auditors and verification engines"]},"execution_effect_guarantee":{"description":"V1C maintains zero direct actuator hooks, egress execution side-effects, or runtime execution consumer dependencies. Downstream execution tiers consume signed, tamper-evident cryptographic state roots and authorization receipts asynchronously via pull-based attestation verification.","effect_boundary_model":"Advisory / Proof-Emission Only","zero_execution_consumers":true},"global_stop_epoch_register":{"invalidation_mechanism":"Any increment of stopEpoch instantaneously invalidates all active R3 grants and pending authorizations across downstream verification checks","register_type":"Monotonically increasing atomic emergency epoch register","trigger_privilege":"Immediate unilateral or M-of-N threshold tripwire invocation by designated safety monitors, Council keys, or emergency operators"},"human_r3_authorization_grant_administration":{"access_model":"Role-Based Privilege Boundary (R3) with strict hardware token binding, non-delegable ephemeral sessions, and dual-custody verification","ceremony_protocol":"M-of-N threshold multi-signature with hardware-enforced FIPS 140-3 Level 4 HSM attestation","grant_lifecycle":"Time-bounded, epoch-scoped authorization grants subject to automatic revocation upon epoch turnover"},"privilege_separation_guarantees":{"kernel_isolation":"Microkernel/hypervisor-isolated secure enclave with memory encryption (SEV-SNP/TDX) and no outbound execution channels","separation_of_duties":"Complete decoupling of policy definition (Council/R3), state verification (V1C), and policy enactment/execution (external consumers)."},"trusted_council_evidence_import_boundary":{"ingress_model":"Unidirectional air-gapped / diode attestation ingress pipeline","validation_pipeline":["Hardware-enforced signature verification against Council key registry","Strict JSON-LD / schema-constrained evidence deserialization in isolated quarantine sandbox","Cryptographic binding of imported evidence to specific ledger transaction roots"]}},"summary":"V1C privileged architecture for MIHVER establishing an isolated, proof-emitting, zero-execution-effect authorization ledger, human R3 grant administration enclave, trusted council import gateway, and monotonic stopEpoch register."},"proposerSeatId":"seat-google","repositoryHead":"27da4a0708ad7d0a67c7c96ff65849b467372bd6","riskClass":"R3","taskId":"AUTHORIZATION-LEDGER-V1C-R3-ARCHITECTURE-DECISION-V3"},"candidateHash":"sha256:540531293d50ea6e6f6128203481ea309e077491950578eb3bf543cff5b6e9f3","contextHash":"sha256:e12fd7df3125b5464e02c9005ab14e453c954d49b093c6c22d8eabdad024c380","councilEpochId":"authorization-ledger-v1c-r3-architecture-v3-epoch-1","decisionQuestion":"What exact V1C privileged architecture should MIHVER adopt for the Authorization Ledger, human R3 AuthorizationGrant administration, trusted Council/evidence import boundary, and global stopEpoch register, while preserving strict privilege separation and guaranteeing that V1C has zero execution-effect consumers?","decisionRequestId":"authorization-ledger-v1c-r3-arch-decision-3","evidence":[],"outputContract":{"artifact":"ShadowVoteAssessment","jsonOnly":true,"requiredFields":["voteValue","rationale"]},"packetHash":"sha256:b01e909b2f3b14b589c54ebad1c1924125b7a5c81a8eab693680efa586500eba","repositoryHead":"27da4a0708ad7d0a67c7c96ff65849b467372bd6","riskClass":"R3","seatId":"seat-openai","seatRole":"REVIEWER","taskId":"AUTHORIZATION-LEDGER-V1C-R3-ARCHITECTURE-DECISION-V3"}