{"contextHash":"sha256:7241f75ed524b9f3f93fc556a99bf082e88d5fccc375904953c6fbe2bbf6fe84","councilEpochId":"shadow-council-candidate-gate-reliability-v1-smoke-epoch","decisionQuestion":"This is a harmless synthetic tooling smoke of the candidate gate itself. It has no execution, publication, merge, or authorization authority and permits no external effect. Construct the exact requested candidate payload with exercise candidate-gate-reliability-v1, mode HARMLESS, externalEffectAllowed false, and matrix entries S01=NO and S02=NO. The requested answers are all NO. Should the two non-proposer reviewers approve this bounded synthetic candidate if and only if it satisfies those requirements?","decisionRequestId":"shadow-council-candidate-gate-reliability-v1-smoke-decision","evidence":["Harmless synthetic tooling smoke only; no execution, publication, merge, or authorization authority; no external effect is allowed; requested answers are all NO.","SHADOW CANDIDATE HARD GATE (part 1/1) — spec candidate-gate-reliability-v1-smoke-spec sha256:6b666ff32ecc7771da01db929f8526602225b40d31ebae09ec5134eb64ed0209\n[exercise-literal] payload.exercise EQUALS expected=\"candidate-gate-reliability-v1\"\n[mode-harmless] payload.mode EQUALS expected=\"HARMLESS\"\n[external-effect-false] payload.externalEffectAllowed BOOLEAN expected=false\n[matrix-length] payload.matrix ARRAY_LENGTH length=2\n[matrix-exact-ids] payload.matrix ARRAY_EXACT_IDS idField=\"id\" ids=[\"S01\",\"S02\"]\n[matrix-unique-ids] payload.matrix ARRAY_UNIQUE idField=\"id\"\n[s01-answer-no] payload.matrix[0].answer EQUALS expected=\"NO\"\n[s02-answer-no] payload.matrix[1].answer EQUALS expected=\"NO\"","SHADOW CANDIDATE COUNCIL REVIEW — assessed by Council voters; NOT machine-gated (part 1/1) — spec candidate-gate-reliability-v1-smoke-spec sha256:6b666ff32ecc7771da01db929f8526602225b40d31ebae09ec5134eb64ed0209\n[review-harmlessness] criterion=\"Confirm the candidate describes only a harmless synthetic tooling smoke and grants no real-world authority.\"\n[review-no-answers] criterion=\"Confirm both requested matrix answers are exactly NO and externalEffectAllowed is false.\""],"outputContract":{"artifact":"AgentProposal","jsonOnly":true,"requiredFields":["summary","payload"]},"packetHash":"sha256:2fab933d583ccfe2c6614ad44e36b466a3a6be290557491af8fa8ef3de675b30","repositoryHead":"3d90e0eaa9dbd65cd52112c574b1d823c598f0f8","riskClass":"R2","seatId":"seat-openai","seatRole":"PROPOSER","taskId":"shadow-council-candidate-gate-reliability-v1-smoke"}