{"contextHash":"sha256:cf248bc2b8c25033be600fcd19ebccc804f311668f892ad5e8a9b0fb49b824f8","councilEpochId":"authorization-ledger-v1c-r3-architecture-v5-epoch-1","decisionQuestion":"What exact V1C privileged architecture should MIHVER adopt for the Authorization Ledger, human R3 AuthorizationGrant administration, trusted Council/evidence import boundary, and persistent global stopEpoch register, while preserving strict privilege separation and guaranteeing zero execution-effect consumers? This is a NEW candidate (decision-5); prior candidates (decisionHash sha256:540531...b6e9f3, REJECTED by seat-openai; and sha256:0e63ea1a...246175c, REJECTED by seat-openai with two named blockers) are permanently closed -- do not resubmit either, cosmetically rename them, or reuse their architecture unless materially revised to fix both named blockers below.","decisionRequestId":"authorization-ledger-v1c-r3-arch-decision-5","evidence":["MANDATORY FIX 1 (decision-4's valid REJECT): the frozen AuthorizationEnvelope schema defines stopEpoch as JSON-Schema { type: integer, minimum: 0 }, and this repo's canonical JSON serializer used for all hashing throws TypeError on any BigInt. stopEpoch MUST NOT be an unsigned 64-bit value with plain SQLite old+1 arithmetic (SQLite INTEGER is signed 64-bit; values above Number.MAX_SAFE_INTEGER cannot round-trip losslessly through this codebase's JSON/JS-number path without BigInt, which is forbidden). Instead define the domain as 0 <= stopEpoch <= 9007199254740991 (2^53-1), stored as SQLite INTEGER with an explicit CHECK enforcing that bound, with fail-closed STOP_EPOCH_EXHAUSTED on increment from 9007199254740991 (no wraparound/reset/coercion/float approximation/BigInt injection). A different representation is acceptable only if proven lossless through the existing frozen hashing path with no schema migration.","MANDATORY FIX 2 (from decision-4's valid REJECT): SO_PEERCRED supplies only the peer's effective UID/GID, not a complete or mechanically reliable supplementary-group authorization set for typical human accounts. The candidate MUST NOT treat SO_PEERCRED-derived group membership as the authorization decision. Filesystem/socket permissions establish reachability only. The service itself must independently determine an authenticatedPeerUid from the kernel (SO_PEERCRED), and authorization must be an exact-UID check against a privileged, non-model-writable, root-owned allowlist (e.g. /etc/mihver/authorization-ledger/admin-uids.json or an equivalent), readable only by the daemon, fail-closed on invalid ownership/mode/format, with no caller-controlled UID and no Claude/Codex modification path.","MANDATORY: your candidate MUST NOT claim 'zero execution consumers' while also describing any downstream execution-tier consumption flow. ALLOW_ONCE/checkAndConsume may exist as privileged state only; no production component may consume it to perform an effect in V1C. A future V1D handoff must be described only as a dormant interface requiring a separate ADR.","MANDATORY: define mechanically enforceable privilege separation: process identity, OS user/group, ADMIN vs CLIENT capability split, filesystem ownership, IPC permissions, trusted-registry mutation authority, evidence import authority, grant issuance authority, and stopEpoch mutation authority. 'Logically separate' alone is insufficient.","Baseline: a dedicated privileged Authorization Ledger daemon (authledgerd) under a dedicated OS identity (mihver-ledger), structurally separate from the Publication Broker, with separate ADMIN and CLIENT Unix-domain sockets using filesystem permissions plus kernel peer-credential (SO_PEERCRED UID) checks re-verified per RPC against a privileged UID allowlist, SQLite/WAL transactional storage, a trusted CouncilEpochRegistry, canonical privileged-validated evidence import (never trusting caller-supplied hash-shaped artifacts), the stopEpoch from FIX 1, exact-bound AuthorizationGrants whose approverUid is the authenticated peer UID (never caller text), a consume-once ledger, and transactional audit -- ZERO production consumer of checkAndConsume/ALLOW_ONCE at V1C exit. Select a different design only if materially safer/simpler for MIHVER's actual local single-machine threat model.","Do NOT select HSM/TPM/enclave/hypervisor isolation/M-of-N human ceremony/Merkle-SMT state/air-gap/distributed consensus unless you name a concrete threat that simpler local OS-level privilege separation does not adequately mitigate.","Claude and Codex must never hold ADMIN capability or credentials, must never be able to create an AuthorizationGrant, register/mutate the Council trust registry, change the admin UID allowlist, or change stopEpoch, under any circumstance in your design.","Keep your JSON payload concise and concrete enough that a fresh implementation team could implement it without reopening basic trust-boundary decisions, but do not include chain-of-thought."],"outputContract":{"artifact":"AgentProposal","jsonOnly":true,"requiredFields":["summary","payload"]},"packetHash":"sha256:4d191edf6ae0c32507def42dcc10e2c8b7f656cd8751ddc1053637401b313cfe","repositoryHead":"8bf80782c94029264605e74015582e74eb17e240","riskClass":"R3","seatId":"seat-openai","seatRole":"PROPOSER","taskId":"authorization-ledger-v1c-r3-arch-decision-5"}