{"contextHash":"sha256:f7c9aa4a018243b001475be324bc7d25b1598340e702644febbc7f967591521c","councilEpochId":"shadow-council-decision-record-persistence-v1-smoke-epoch","decisionQuestion":"Harmless synthetic R2 smoke candidate: should this bounded, no-op documentation-only decision be approved for the sole purpose of proving DecisionRecord persistence works end-to-end against real seat CLIs?","decisionRequestId":"shadow-council-decision-record-persistence-v1-smoke-1","evidence":["This is a synthetic smoke exercise for SHADOW-COUNCIL-DECISION-RECORD-PERSISTENCE-V1; it is not a real architecture or authorization decision."],"outputContract":{"artifact":"AgentProposal","jsonOnly":true,"requiredFields":["summary","payload"]},"packetHash":"sha256:1a7d1df93fecd3a648ca4eebb4ecd1f14561b18329d11c242854e8076c632389","repositoryHead":"f05d01f766e74abdeaac8e8fe9b6835eb366a83e","riskClass":"R2","seatId":"seat-openai","seatRole":"PROPOSER","taskId":"SHADOW-COUNCIL-DECISION-RECORD-PERSISTENCE-V1"}